{
  "boxes": [
    {
      "fromFrame": 0,
      "h": 44,
      "kind": "hurt",
      "w": 26,
      "x": 0,
      "y": 0
    },
    {
      "fromFrame": 14,
      "h": 14,
      "kind": "hit",
      "w": 30,
      "x": 20,
      "y": 34
    },
    {
      "fromFrame": 20,
      "h": 44,
      "kind": "hurt",
      "w": 26,
      "x": 0,
      "y": 0
    }
  ],
  "cancels": {
    "cancelFromPhase": [
      "recovery"
    ],
    "onBlock": [],
    "onHit": [
      "example_back_suplex"
    ],
    "onWhiff": []
  },
  "conditions": {
    "attackerState": [
      "standing"
    ],
    "opponentState": [
      "standing",
      "crouching"
    ],
    "position": [
      "anywhere"
    ]
  },
  "id": "example_running_lariat",
  "input": {
    "bufferWindow": 6,
    "motionWindow": 12,
    "notation": "FF+P (dash, then punch)"
  },
  "name": "Running Lariat (example)",
  "outcome": {
    "blockstun": 11,
    "damage": 90,
    "hitstop": 8,
    "hitstun": 17,
    "launch": false,
    "onBlock": -4,
    "onHit": 2,
    "pushback": 6
  },
  "phases": {
    "active": 6,
    "recovery": 18,
    "startup": 14
  },
  "meta": {
    "status": "FORMAT EXAMPLE ONLY — placeholder values demonstrating frame-data.schema.json end to end. This is not a BANNON character, not a canon move, and none of its numbers are tuned or approved. Real moves are authored in the Brutal Fist home repo under its own canon process."
  }
}
